João Miguel Macedo da Silva,23,190,78,Portugal,Vitória Guimarães,75,80,6500000,7000,Right,1,3,1,Lean,14100000.0,SUB,56,01/07/2015,2022,,,,,,,77.0,71.0,64.0,78.0,49.0,73.0,12,5,14,26,9,8,11,13,20,11,48,50,30,74,33,21,72,27,58,6,20,7,8,40,13,37,16,14,14,77,71,64,73,78, Portuguese Liga ZON SAGRES (1),17.0,1.0,163.0,"['What the fuck EA! ', '84 potential again next week 😂😂', 'nope', 'Just got fucked by EA. Luckily I brought him when he has 84 potential ', 'What in the actual f**k?', 'RIP', '-5 pot? Did he do something wrong?', 'What???? ', ""Because he don't play every game doesn't mean he won't be good ..."", 'He has picture in game ! So many players that do not have picture here in Sofifa but they actually have it in game.  ', 'Same as Gabigol', '3. Who deleted/removed my comment?\nThe site manager, page mod and squad/shortlist creator could approve or delete/remove comments.', ""4. You could block a user from the user's profile, the user will not get notified when you block them.\nAfter you've blocked a user, they cannot:\n• Send you any notifications\n• See your posts"", '© 2009 - 2020 Powered by SoFIFA.com. FIFA series and all FIFA assets are property of EA Sports.\nTerms Privacy Contact us at team@sofifa.com']",990,0,2
Matz Sels,26,190,88,Belgium,RC Strasbourg Alsace,75,78,6000000,14000,Right,1,3,1,Normal,12500000.0,GK,1,26/07/2018,2022,,,,,,,79.0,69.0,70.0,78.0,36.0,75.0,16,16,14,32,19,19,17,17,30,33,37,35,36,70,34,38,64,30,67,18,24,13,18,45,22,60,12,13,14,79,69,70,75,78, French Ligue 1 (1),4.0,0.0,88.0,"['Another big game, he deserves a big upgrade, 81/84 would be fair ', '', 'Newcastle legend', 'Man of the match against PSG', 'Amazed this lad has actually came good after his awful time at Newcastle, I thought we had destroyed any confidence he had. Does he still get his dodgy moments? or is he finally back to being solid?', ""He's so good"", ""Not a single dodgy moments, he's really doing well"", 'Without him we would be at 15th place without a doubt, he saved us so many times', 'Really helping atrasbourg go good', 'Deserved upgrade', 'really good keeper !!!', '3. Who deleted/removed my comment?\nThe site manager, page mod and squad/shortlist creator could approve or delete/remove comments.', ""4. You could block a user from the user's profile, the user will not get notified when you block them.\nAfter you've blocked a user, they cannot:\n• Send you any notifications\n• See your posts"", '© 2009 - 2020 Powered by SoFIFA.com. FIFA series and all FIFA assets are property of EA Sports.\nTerms Privacy Contact us at team@sofifa.com']",3330,0,8
Marco Bizot,27,194,85,Netherlands,AZ Alkmaar,75,78,5500000,11000,Right,1,2,1,Normal,8700000.0,GK,1,01/07/2017,2021,,,,,,,79.0,72.0,63.0,76.0,46.0,71.0,20,15,16,28,13,12,20,15,33,32,45,47,50,74,40,26,67,32,64,14,39,17,13,47,36,60,11,12,14,79,72,63,71,76, Holland Eredivisie (1),2.0,0.0,28.0,"['Legend', '79-80', ""Deserved upgrade... but he's as good, if not slightly better than Padt. So 77 /79 or 78 /80."", '76/79', 'Sad that he left Genk. Well, good luck in Alkmaar.', 'Smart move, AZ.', '', ""He was very, very good at Groningen. Now that they have an idiot in the goal it's obvious how good Bizot was in retrospect."", 'You think Padt is an idiot?', 'Ask anyone around Groningen.', 'The man is a heavy drinker, actively goes after teammates girlfriends/wifes and when under influence of alcohol a real bastard.', '', ""That's no top sport mentality."", 'Linked to AZ Alkmaar. ', '3. Who deleted/removed my comment?\nThe site manager, page mod and squad/shortlist creator could approve or delete/remove comments.', ""4. You could block a user from the user's profile, the user will not get notified when you block them.\nAfter you've blocked a user, they cannot:\n• Send you any notifications\n• See your posts"", '© 2009 - 2020 Powered by SoFIFA.com. FIFA series and all FIFA assets are property of EA Sports.\nTerms Privacy Contact us at team@sofifa.com']",3060,0,14
Yoan Cardinale,24,181,84,France,OGC Nice,75,78,6000000,18000,Right,2,3,1,Stocky,11900000.0,SUB,30,01/07/2015,2021,,,,,,,76.0,72.0,75.0,78.0,46.0,73.0,20,14,16,52,20,25,13,18,41,30,53,40,43,68,47,25,57,36,76,20,37,15,12,48,23,57,9,14,16,76,72,75,73,78, French Ligue 1 (1),12.0,0.0,172.0,"['We can’t which sucks. Ea really messed up there', 'i have the same problem:/...really stupid', 'So shit for me. 32 appereances with 5 clean sheets.', 'Only 5\'11"" that\'ll be why he\'s shit.', 'Hes contract expires, after the winter transfer window, you can negotiate with him directly.', '*during the winter transfer window', 'Overrated. 76/79.', 'No way he can be 79 rated. More 76.', ""84 for me at the end of the 2nd season and barely trained him. Really solid IG as well, makes crucial saves and is good at collecting crosses even though he's short."", '55 jumping seems pretty harsh for a 5\'11"" GK', ""From what I've seen he pretty bad at dealing with any balls that are in the air (crosses, corners, long shots) 55 jumping is fair"", '78/84', '3. Who deleted/removed my comment?\nThe site manager, page mod and squad/shortlist creator could approve or delete/remove comments.', ""4. You could block a user from the user's profile, the user will not get notified when you block them.\nAfter you've blocked a user, they cannot:\n• Send you any notifications\n• See your posts"", '© 2009 - 2020 Powered by SoFIFA.com. FIFA series and all FIFA assets are property of EA Sports.\nTerms Privacy Contact us at team@sofifa.com']",270,0,0
Lars Unnerstall,27,198,103,Germany,VVV-Venlo,75,77,5500000,11000,Right,1,1,1,Stocky,,GK,1,,2019,,,,,,,75.0,74.0,71.0,77.0,33.0,74.0,10,13,10,26,15,16,13,11,24,19,28,37,19,72,20,14,40,35,82,12,36,21,13,42,16,58,11,17,15,75,74,71,74,77, Holland Eredivisie (1),5.0,1.0,19.0,"['78-80', '77/80', ""One of the best gk's at Eredivisie"", 'this man is a beast in goal', 'Very much deserved.The former Schalke man has been outstanding for VVV-Venlo.', 'Is moving to PSV', 'But being loaned back for a year', ""Great game against Feyenoord even if they (Feyenoord) weren't playing very well. Hope he'll go to Groningen in the summer when Padt leaves but that's probably unlikely."", 'So great for VVV so far', ""Did he get a downgrade because he went to VVV? Nonsense! He's been doing great. One of the best goalkeepers in the eredivisie."", '3. Who deleted/removed my comment?\nThe site manager, page mod and squad/shortlist creator could approve or delete/remove comments.', ""4. You could block a user from the user's profile, the user will not get notified when you block them.\nAfter you've blocked a user, they cannot:\n• Send you any notifications\n• See your posts"", '© 2009 - 2020 Powered by SoFIFA.com. FIFA series and all FIFA assets are property of EA Sports.\nTerms Privacy Contact us at team@sofifa.com']",2900,0,5
Robin Olsen,28,198,88,Sweden,Roma,75,77,5500000,39000,Right,1,2,1,Normal,9800000.0,GK,1,24/07/2018,2022,,,,,,,74.0,74.0,71.0,75.0,36.0,75.0,20,11,16,32,16,11,18,16,37,18,31,40,32,70,33,20,40,37,75,14,27,20,13,55,26,45,22,12,16,74,74,71,75,75, Italian Serie A (1),7.0,3.0,27.0,"['Said it from the start that he’s highly underrated it’s just Roma’s defence that was piss poor', 'the defence was terrible yes, but he was also horrendous. ', 'Countless mistakes where done almost every game', 'No communication what so ever with the defenders', 'Cant start the play from the back either', 'the 0 communication could be excusable, reason he couldnt do a shoutout was because he doesnt know how to speak italian.', ""You don't need to speak the entire language to know the key words to lead the defence."", '', 'I would understand he would struggle with that in the beginning but it was also a factor at the end of the season', '', 'Would you need more than 5 months to know about 10 important phrases?', '60/61', 'Close to joining Watford', ""People are little to harsh on him, he was transfered from the danish league to the italian league it's hard ro get used to it the first season. He got that special something. Give hime one more season."", ""Yeah, he's especially weak. He's a fking keeper, wasn't he used to block shots in the danish league? Well, I mean, maybe not seeing how he played thie season..."", 'The thing is, there is a huge quality difference between The danish Superliga and Serie A, do expect a goalkeeper from the danish league who played very good one season to be world class in a top club in Serie A? He is adapting to Serie A. Well he plays pretty good in Cagliari for the moment.', '76/77', 'Really good reflexes unfortunately has nothing else going for him', '77/77', '3. Who deleted/removed my comment?\nThe site manager, page mod and squad/shortlist creator could approve or delete/remove comments.']",2430,0,4
Joel Robles Blázquez,28,195,90,Spain,Real Betis,75,76,5500000,17000,Right,1,2,1,Lean,12000000.0,SUB,1,05/07/2018,2022,,,,,,,79.0,70.0,76.0,78.0,48.0,71.0,12,11,12,15,13,15,11,20,26,25,46,50,43,66,39,36,64,25,69,11,23,22,13,41,15,54,11,11,14,79,70,76,71,78, Spain Primera Division (1),3.0,0.0,60.0,"['Take a bow, son. Playing out of his mind. ', '79/79', '80/81', '79/79', 'Way better than this. 78 at least', 'I watch most Betis games. 78/78. This player is incredible whenever he plays', '8 games played so far this season, 7 without conceding a goal.', '3. Who deleted/removed my comment?\nThe site manager, page mod and squad/shortlist creator could approve or delete/remove comments.', ""4. You could block a user from the user's profile, the user will not get notified when you block them.\nAfter you've blocked a user, they cannot:\n• Send you any notifications\n• See your posts"", '© 2009 - 2020 Powered by SoFIFA.com. FIFA series and all FIFA assets are property of EA Sports.\nTerms Privacy Contact us at team@sofifa.com']",450,0,1
Harun Tekin,29,187,78,Turkey,Fenerbahçe SK,75,76,5000000,42000,Right,1,1,1,Normal,9900000.0,GK,35,30/08/2018,2021,,,,,,,77.0,70.0,69.0,80.0,38.0,73.0,14,10,11,23,11,14,12,11,17,23,40,37,39,72,38,21,70,22,51,12,26,16,11,42,18,63,13,14,12,77,70,69,73,80, Turkish Süper Lig (1),2.0,0.0,10.0,"['Cautious With Crosses', '76 reactions', 'Saved last 10/19 penalty’s... absolutely a penalty monster', 'Penalty monster, saves almost all pens', 'Brilliant penalty save against Zenit tonight, kept his team in the game after having minimum contact with the ball in the first half.', '76 seems too low', ""79'u var bu adamın ama açılan her orta tehlike. Refleksleri ve uçarak yaptığı kurtartışlar a sınıf da şu açılan yan toplarda o kadar kötü ki zaten gollerin çoğunu öyle yedi."", 'underrated. 77/78 at least.', 'siktirlan en fazla 65', 'deserve 78/80', '3. Who deleted/removed my comment?\nThe site manager, page mod and squad/shortlist creator could approve or delete/remove comments.', ""4. You could block a user from the user's profile, the user will not get notified when you block them.\nAfter you've blocked a user, they cannot:\n• Send you any notifications\n• See your posts"", '© 2009 - 2020 Powered by SoFIFA.com. FIFA series and all FIFA assets are property of EA Sports.\nTerms Privacy Contact us at team@sofifa.com']",2250,0,7
Ludovic Butelle,35,188,84,France,Angers SCO,75,75,1600000,11000,Left,2,3,1,Normal,3100000.0,GK,16,04/01/2018,2020,,,,,,,78.0,74.0,65.0,74.0,36.0,76.0,11,11,13,31,12,11,10,15,23,23,35,37,37,66,28,24,63,28,69,12,35,18,15,44,22,59,11,11,11,78,74,65,76,74, French Ligue 1 (1),0.0,0.0,3.0,"[""Has been playing like a 68-71 rated keeper for months now and that's not even hyperbole. A firm downgrade to 74-75 would be in its place if he doesn't pick himself up before January."", ""I know all goal keepers got upgrades, but it's just painful for someone like Mignolet to be rated 78 while Butelle is 77. Come on."", '77?! ahaha what a joke', ""0 points, 1 goal for, 17 against, that's a joke. Butelle's personal life affected his form last season, his son had cardiac surgery."", 'overrated', '76 OVR would be more realistic', 'not really since all the other massive upgrades for goalkeepers...', ""i disagree, he had a very good season last year, but a 78 is really not an appriopriate rating, he's not better than proto and Sels who both have a 77 rating"", 'He is 32?', '78 deserves', '3. Who deleted/removed my comment?\nThe site manager, page mod and squad/shortlist creator could approve or delete/remove comments.', ""4. You could block a user from the user's profile, the user will not get notified when you block them.\nAfter you've blocked a user, they cannot:\n• Send you any notifications\n• See your posts"", '© 2009 - 2020 Powered by SoFIFA.com. FIFA series and all FIFA assets are property of EA Sports.\nTerms Privacy Contact us at team@sofifa.com']",3240,0,12
Artur Boruc,38,193,87,Poland,Bournemouth,75,75,450000,25000,Right,2,3,1,Normal,855000.0,SUB,1,01/07/2015,2019,,,,,,,75.0,73.0,62.0,76.0,38.0,77.0,12,11,11,25,13,14,13,19,34,18,37,39,40,70,40,21,73,31,69,15,38,25,17,40,21,63,15,20,20,75,73,62,77,76, English Premier League (1),9.0,2.0,38.0,"['2 star international reputation? joke 4+ is fair', 'should start next game', 'Legend <3', 'http://www.bournemouthecho.co.uk/sport/16232784.Goalkeeper_Boruc_signs_new_deal_with_Cherries/#comments-anchor', ' ', '', 'WTF ...', 'His last appearance on national team will be placed on National Stadium in Warsaw against Uruguay (10th November). He will be playing 44 minutes.', 'Why did he only play 44 minutes?', 'To form a guard of honor before half time. since he had, before the match ""Officially"" retired however, we wanted him to get a proper goodbye.', 'Because he had time to say goodbye for fans.', 'in form', 'downgrade', 'dat smile.', 'scary.', '3. Who deleted/removed my comment?\nThe site manager, page mod and squad/shortlist creator could approve or delete/remove comments.', ""4. You could block a user from the user's profile, the user will not get notified when you block them.\nAfter you've blocked a user, they cannot:\n• Send you any notifications\n• See your posts"", '© 2009 - 2020 Powered by SoFIFA.com. FIFA series and all FIFA assets are property of EA Sports.\nTerms Privacy Contact us at team@sofifa.com']",1080,0,4
Yohann Pelé,35,196,89,France,Olympique de Marseille,75,75,1600000,19000,Right,1,3,1,Normal,3000000.0,SUB,16,01/07/2015,2020,,,,,,,75.0,76.0,67.0,76.0,49.0,72.0,15,14,16,34,11,13,14,15,33,18,51,47,42,70,54,17,67,32,78,13,33,24,15,14,13,64,14,13,12,75,76,67,72,76, French Ligue 1 (1),2.0,0.0,10.0,"['Amazing keeper! 77/77', '79/79', 'He deserves 79/79 or 80/80 since last year', 'Wtf and People were saying they need Mandanda badly back.', 'We need mandanda back. Good game for pelé but mandanda is far far better', '84/96', 'Best Pelé in the history of football', 'The true pele', '71-71', '80-80', '3. Who deleted/removed my comment?\nThe site manager, page mod and squad/shortlist creator could approve or delete/remove comments.', ""4. You could block a user from the user's profile, the user will not get notified when you block them.\nAfter you've blocked a user, they cannot:\n• Send you any notifications\n• See your posts"", '© 2009 - 2020 Powered by SoFIFA.com. FIFA series and all FIFA assets are property of EA Sports.\nTerms Privacy Contact us at team@sofifa.com']",680,0,3
Rafael  de Andrade Bittencourt Pinheiro,36,187,80,Brazil,Cagliari,75,75,900000,14000,Left,2,3,1,Lean,1600000.0,SUB,1,08/07/2016,2019,,,,,,,76.0,71.0,63.0,79.0,36.0,76.0,13,11,10,25,10,13,11,12,24,23,43,31,31,70,23,21,63,41,49,14,31,10,12,45,22,60,20,19,17,76,71,63,76,79, Italian Serie A (1),1.0,0.0,9.0,"['3. Who deleted/removed my comment?\nThe site manager, page mod and squad/shortlist creator could approve or delete/remove comments.', ""4. You could block a user from the user's profile, the user will not get notified when you block them.\nAfter you've blocked a user, they cannot:\n• Send you any notifications\n• See your posts"", '© 2009 - 2020 Powered by SoFIFA.com. FIFA series and all FIFA assets are property of EA Sports.\nTerms Privacy Contact us at team@sofifa.com']",0,0,0
Volkan Demirel,36,191,90,Turkey,Fenerbahçe SK,75,75,900000,25000,Right,2,2,1,Stocky,1700000.0,SUB,1,06/08/2002,2019,,,,,,,75.0,73.0,75.0,74.0,41.0,77.0,18,14,18,38,13,25,11,15,42,28,41,41,45,71,35,25,70,42,84,12,45,19,12,50,11,50,22,14,17,75,73,75,77,74, Turkish Süper Lig (1),6.0,3.0,17.0,"['İnsan falan değil yaban domuzu bu mahlukat', 'aynı şeyi yüzüne karşı söyler miydin?', 'Neden söylemeyeyim. Kendisi her seferinde agresif olmak iyi değil diyip aynı şeyleri tekrarlıyor. Herif kendi takım arkadaşlarına, taraftarlarına, rakiplerine ana bacı sövecek biz domuz diyemeyeceğiz.', 'A legend but he is doing horrible in the recent years', 'the turkish buffon and ffs ea give him at leas a real face', 'He is not Turkish Buffon. Not even in one sense.', ""Harun'dan daha iyi kaleci olduğunu düşünüyorum."", 'One of the most overrated Turkish goalkeepers ever. His career highlights have mostly been matches against Beşiktaş, Galatasaray and Trabzon. For the rest of the matches, he used to play insanely great only he wanted - he usually lacked concentration and awareness and conceded many critical goals that have fucked Fenerbahçe over and over. ', '', 'Especially he has always sucked at stopping long shots and his shit tempered almost caused Turkey getting knocked out at Euro 2008 against Czech Republic. He mostly displayed shitty performances for Turkey as well.', '', ""I don't think that Fenerbahçe fans with common sense really like him at all or see him as a club legend."", ""I disagree. He was too good for the league most of his career and he still stayed in Fenerbahçe, but it's also true that Muslera was always better. Galatasaray got lucky with that guy."", '70/70', 'Limit.', '71', '3. Who deleted/removed my comment?\nThe site manager, page mod and squad/shortlist creator could approve or delete/remove comments.', ""4. You could block a user from the user's profile, the user will not get notified when you block them.\nAfter you've blocked a user, they cannot:\n• Send you any notifications\n• See your posts"", '© 2009 - 2020 Powered by SoFIFA.com. FIFA series and all FIFA assets are property of EA Sports.\nTerms Privacy Contact us at team@sofifa.com']",1080,0,1
Ramazan Özcan,34,187,84,Austria,Bayer 04 Leverkusen,75,75,2700000,36000,Left,1,2,1,Normal,4600000.0,SUB,28,01/07/2016,2019,,,,,,,73.0,71.0,71.0,75.0,51.0,76.0,12,14,14,34,13,13,14,19,26,14,52,51,48,73,36,23,71,36,72,17,32,22,10,32,16,53,12,14,13,73,71,71,76,75, German 1. Bundesliga (1),2.0,1.0,3.0,"['Moving to bayer', 'But they have leno ', 'he is one of the best in the bundesliga, should have better OVR', 'dont get the downgrade in reflex, has amazing reflexes irl', '3. Who deleted/removed my comment?\nThe site manager, page mod and squad/shortlist creator could approve or delete/remove comments.', ""4. You could block a user from the user's profile, the user will not get notified when you block them.\nAfter you've blocked a user, they cannot:\n• Send you any notifications\n• See your posts"", '© 2009 - 2020 Powered by SoFIFA.com. FIFA series and all FIFA assets are property of EA Sports.\nTerms Privacy Contact us at team@sofifa.com']",180,0,0
Kenneth Vermeer,32,183,80,Netherlands,Feyenoord,75,75,3800000,10000,Right,2,4,1,Normal,5400000.0,SUB,1,01/09/2014,2020,,,,,,,78.0,65.0,69.0,80.0,59.0,78.0,13,13,16,53,11,25,16,13,33,39,64,55,64,71,57,24,80,40,57,13,35,25,19,66,30,64,14,16,14,78,65,69,78,80, Holland Eredivisie (1),5.0,0.0,18.0,"['72/72', '78-78', 'Should be 77', 'Undeserved downgrade', 'out for the rest of the season.', 'Huge blow for Club Brugge', 'Indeed, Gabulov is up again.', 'Showing good form.', ""It's a bit relative because the keepers before him were just plain bad, but he's actually performing quite nicely in my opinion. Not quite the level of a 77 rated goalie, but doing good considering he hasn't played for so long"", 'Probably going to get his chance soon.', 'He sure did. Heh', '3. Who deleted/removed my comment?\nThe site manager, page mod and squad/shortlist creator could approve or delete/remove comments.', ""4. You could block a user from the user's profile, the user will not get notified when you block them.\nAfter you've blocked a user, they cannot:\n• Send you any notifications\n• See your posts"", '© 2009 - 2020 Powered by SoFIFA.com. FIFA series and all FIFA assets are property of EA Sports.\nTerms Privacy Contact us at team@sofifa.com']",1511,0,5
Wayne  Hennessey,31,198,90,Wales,Crystal Palace,75,75,4000000,34000,Right,2,3,1,Lean,7700000.0,GK,13,31/01/2014,2021,,,,,,,73.0,76.0,81.0,72.0,41.0,76.0,11,12,14,29,10,8,12,11,41,23,40,41,48,65,51,34,41,29,68,10,21,22,14,58,17,55,13,18,13,73,76,81,76,72, English Premier League (1),4.0,2.0,29.0,"['The 2nd', 'https://www.bbc.co.uk/sport/football/47946382', 'Wayne Hennessy found not guilty of making a Nazi salute despite image clearly showing him making a Nazi salute.. ', '', 'Seriously going off football.', 'Media:76', 'Potencial:76', '', 'posicionamiento +1', 'reflejos +1', 'Nazi', 'FA have charged him for his Nazi Salute.', 'Awful vs us coming on at half time.', 'nazi scum', 'No.', '3. Who deleted/removed my comment?\nThe site manager, page mod and squad/shortlist creator could approve or delete/remove comments.', ""4. You could block a user from the user's profile, the user will not get notified when you block them.\nAfter you've blocked a user, they cannot:\n• Send you any notifications\n• See your posts"", '© 2009 - 2020 Powered by SoFIFA.com. FIFA series and all FIFA assets are property of EA Sports.\nTerms Privacy Contact us at team@sofifa.com']",1575,0,5
Matúš Kozáčik,34,193,91,Slovakia,Viktoria Plzeň,75,75,2700000,1000,Right,1,2,1,Normal,5900000.0,GK,1,01/07/2012,2021,,,,,,,78.0,71.0,69.0,74.0,57.0,79.0,9,9,10,28,12,11,18,10,28,21,57,57,50,64,30,22,68,25,63,11,38,25,12,64,23,63,18,9,9,78-1,71,69-6,79+3,74, Czech Republic Gambrinus Liga (1),0.0,0.0,2.0,['© 2009 - 2020 Powered by SoFIFA.com. FIFA series and all FIFA assets are property of EA Sports.\nTerms Privacy Contact us at team@sofifa.com'],990,0,6
Oier Olazábal Paredes,28,190,91,Spain,Levante UD,75,75,4700000,17000,Left,1,3,1,Normal,9800000.0,GK,13,01/07/2017,2021,,,,,,,77.0,73.0,69.0,73.0,44.0,78.0,23,14,15,34-1,12,20,24,15,36+3,20,45,43,48,70,40,20,66,43,66,15,28,20-Oct,13,46,25,54,15-Jul,18,16,77,73,69,78,73, Spain Primera Division (1),3.0,0.0,10.0,"['79/80', 'Great performance against Real Madrid', 'Barca should get him back if Cillessen leaves', ""Dang that's an old comment"", 'Welcome to Real Sociedad!', 'Joined Sociedad', 'Barca Legend!', 'Rest in peace 5/4/2015 - Murdered by CR7', '3. Who deleted/removed my comment?\nThe site manager, page mod and squad/shortlist creator could approve or delete/remove comments.', ""4. You could block a user from the user's profile, the user will not get notified when you block them.\nAfter you've blocked a user, they cannot:\n• Send you any notifications\n• See your posts"", '© 2009 - 2020 Powered by SoFIFA.com. FIFA series and all FIFA assets are property of EA Sports.\nTerms Privacy Contact us at team@sofifa.com']",1890,0,5
Johannes Hopf,31,194,94,Sweden,MKE Ankaragücü,75,75,4000000,16000,Right,1,3,1,Normal,8100000.0,GK,34,14/07/2018,2021,,,,,,,73.0,74.0,70.0,75.0,45.0,76.0,20,13,20,29,20,15,24,19,34,23,42,47,41,68,30,19,53,23,81,17,44,21,14,40,19,62,12,16,18,73,74,70,76,75, Turkish Süper Lig (1),0.0,0.0,5.0,"['Underrated deserves 72 OVR definetly Swedens best GK', 'Underrated 72/72', 'Should definetly play for the Swedish National team', 'Heard that besiktas wants him, really glad for him. He wasnt that good in sweden, but hopefully he will earn a place in the national team asap!', 'Really? The best goalkeeper in the Turkish league at the moment, is really on form but gets -2 in OVR and POT...EA..get your shit together...', ""hahaahh best GK in the Super Lig? are u crazy lol his pretty good but there are many better GK's in the league"", 'Both muslera anf zengin are highly overrated', ""zengin? his 74 rated, Muslera overrated? i dont think i'm gonna talk fotball with you bye"", 'Yep they are both overrated, get over it', ""Someone saying Muslera is overrated should stop watching football seriously his criminally underrated gtfo now i'm not gonna answer you anymore its not worth the time lol"", 'That you just compared Hopf with Muslera hahah lol i dont even know what to say', 'not worth the trouble talking to that retard, he got a major brain malfunction called ""liverpool""', 'Äru svensk?', 'Är du här och skämmer ut dig också? Borde inte sådana som du inse att du inte fyller någon funktion i livet och ha ihjäl dig själv? :) ingen skulle sakna dig ditt United pack :) gick jättebra i europa league din lilla pajas', 'GTFO', 'Naw snutte, mammas lilla pojke. Så synd om lilla krymplingen', 'When did i compare hopf with muslera? All i said was that muslera and zengin är overrated. Which is the truth. Dont get so butthurt all the time', 'Underrated', '3. Who deleted/removed my comment?\nThe site manager, page mod and squad/shortlist creator could approve or delete/remove comments.', ""4. You could block a user from the user's profile, the user will not get notified when you block them.\nAfter you've blocked a user, they cannot:\n• Send you any notifications\n• See your posts""]",720,0,3
